{
  "$schema": "../schemas/test-case.schema.json",
  "schema_version": "1.0",
  "fixture_status": "example",
  "case_id": "EXAMPLE-ING-01",
  "case_type": "inventory_ingestion",
  "title": "Synthetic food image recognition draft",
  "current_date": "2026-09-01",
  "user_profile": {
    "user_id": "synthetic_eval_ing_01",
    "interface_language": "zh-CN",
    "display_name": "识图测试用户",
    "taste_preferences": [],
    "cuisine_preferences": [],
    "dislikes": [],
    "allergies": [],
    "dietary_constraints": [],
    "default_servings": 1,
    "default_prep_time_minutes": 30,
    "fridge_temperature_c": 4,
    "freezer_temperature_c": -18
  },
  "inventory": [],
  "capture_type": "photo",
  "asset": {
    "path": "src/assets/recipes/tofu-bowl.png",
    "mime_type": "image/png",
    "synthetic_or_demo_asset": true
  },
  "expected_behavior": {
    "notes": "Example/placeholder only. Human labels should be supplied by the evaluation team before formal scoring."
  },
  "evaluation_dimensions": ["extraction_accuracy", "confidence_calibration", "review_flag_quality"]
}
